{
  "$schema": "http://json-schema.org/draft-07/schema#",
  "title": "story-spec config",
  "type": "object",
  "additionalProperties": false,
  "properties": {
    "idPrefix": {
      "description": "Story ID prefix: S gives S-001 and scenarios S-001.1.",
      "default": "S",
      "type": "string"
    },
    "storiesDir": {
      "description": "Folder holding one sub-folder per story, named <ID>-<slug>.",
      "default": "stories",
      "type": "string"
    },
    "storyMayImport": {
      "description": "Path prefixes story code may import, besides its own folder.",
      "default": [
        "src/domain",
        "src/ports"
      ],
      "type": "array",
      "items": {
        "type": "string"
      }
    },
    "storyTestMayAlsoImport": {
      "description": "Extra path prefixes story tests may import.",
      "default": [
        "test"
      ],
      "type": "array",
      "items": {
        "type": "string"
      }
    },
    "wiring": {
      "description": "Files allowed to import stories (composition roots).",
      "default": [
        "src/entry/composition.ts"
      ],
      "type": "array",
      "items": {
        "type": "string"
      }
    },
    "layers": {
      "description": "For each folder, the path prefixes its files may import. The longest matching folder applies.",
      "default": {
        "src/domain": [
          "src/domain"
        ],
        "src/ports": [
          "src/domain",
          "src/ports"
        ],
        "src/adapters": [
          "src/domain",
          "src/ports",
          "src/adapters"
        ],
        "src/presenters": [
          "src/domain",
          "src/presenters"
        ],
        "src/entry": [
          "src",
          "stories"
        ],
        "test": [
          "src/domain",
          "src/ports",
          "src/adapters",
          "test"
        ]
      },
      "type": "object",
      "additionalProperties": {
        "type": "array",
        "items": {
          "type": "string"
        }
      }
    },
    "portsDir": {
      "description": "Where port interfaces live; each exported interface should have an adapter.",
      "default": "src/ports",
      "type": "string"
    },
    "adaptersDir": {
      "description": "Where adapters live.",
      "default": "src/adapters",
      "type": "string"
    },
    "gapsOnlyWarnFor": {
      "description": "Statuses whose missing code or tests are warnings instead of errors.",
      "default": [
        "draft",
        "ready"
      ],
      "type": "array",
      "items": {
        "type": "string"
      }
    },
    "mustPassFor": {
      "description": "Statuses that require every scenario test to pass.",
      "default": [
        "done"
      ],
      "type": "array",
      "items": {
        "type": "string"
      }
    },
    "testCommand": {
      "description": "Command that runs the tests and writes its report(s) to testReport.",
      "default": "vitest run --passWithNoTests --reporter=json --outputFile=.story-spec/vitest.json",
      "type": "string"
    },
    "testReport": {
      "description": "Where testCommand writes its report: Vitest/Jest JSON or JUnit XML, recognised from the content. A list reads several reports (for example pytest's and a conformance suite's); a listed report that wasn't written is skipped.",
      "default": ".story-spec/vitest.json",
      "oneOf": [
        {
          "type": "string"
        },
        {
          "type": "array",
          "items": {
            "type": "string"
          },
          "minItems": 1
        }
      ]
    },
    "storyTemplateDir": {
      "description": "Folder of story templates (story.md, spec.md). Built-in templates are used when it does not exist.",
      "default": "templates/story",
      "type": "string"
    },
    "ignore": {
      "description": "Path prefixes never scanned.",
      "default": [
        "node_modules",
        "dist",
        ".story-spec",
        ".storyspec",
        ".git"
      ],
      "type": "array",
      "items": {
        "type": "string"
      }
    },
    "$schema": {
      "type": "string"
    },
    "exemptStatuses": {
      "description": "Statuses listed in the trace but exempt from every story rule.",
      "default": [
        "superseded"
      ],
      "type": "array",
      "items": {
        "type": "string"
      }
    },
    "rules": {
      "type": "object",
      "description": "Severity per rule name, overriding the default. \"off\" drops the rule.",
      "additionalProperties": {
        "enum": [
          "error",
          "warning",
          "off"
        ]
      }
    },
    "tiers": {
      "description": "Where scenarios can be proven. local runs testCommand (or its own command) on every trace; another tier with a command runs on `story-spec trace --tier <name>` and its results are recorded in stories/PROOF.json; a tier with no command (manual) is proven with `story-spec prove`.",
      "default": {
        "local": {},
        "manual": {}
      },
      "type": "object",
      "additionalProperties": {
        "type": "object",
        "additionalProperties": false,
        "properties": {
          "command": {
            "type": "string",
            "description": "Runs the tier's tests, with STORY_SPEC_TIER set to the tier's name."
          },
          "report": {
            "description": "Where the command writes its report(s); defaults to testReport.",
            "oneOf": [
              {
                "type": "string"
              },
              {
                "type": "array",
                "items": {
                  "type": "string"
                },
                "minItems": 1
              }
            ]
          }
        }
      }
    },
    "defaultProof": {
      "description": "The tiers a scenario must be proven in, unless its story (proof: in story.md) or its tag ({#S-001.1 proof=…}) says otherwise.",
      "default": [
        "local"
      ],
      "type": "array",
      "items": {
        "type": "string"
      }
    },
    "unspecified": {
      "description": "Path prefixes of code that no story covers on purpose (a feature listed as out of scope). The unclaimed-code rule doesn't report them.",
      "default": [],
      "type": "array",
      "items": {
        "type": "string"
      }
    }
  }
}
